{"schemaVersion": 1, "artifactType": "routine-semantic-synthetic-bundle-v1", "consumerPlanSha256": "7bafa1fb625745bf44bbc2042981c19d89db0e08863b0b203d76151b14f442c7", "producerPlan": {"schemaVersion": 1, "artifactType": "routine-semantic-prepared-plan-v1", "candidateId": "1111111111111111111111111111111111111111111111111111111111111111", "authority": {"repository": "https://example.test/repo.git", "sourceRevision": "bbbbbbbbbbbbbbbbbbbbbbbbbbbbbbbbbbbbbbbb", "root": null, "rootIsTrustedInput": false}, "sourceInventory": {"sourceRevision": "bbbbbbbbbbbbbbbbbbbbbbbbbbbbbbbbbbbbbbbb", "files": [{"path": "skills/example/SKILL.md", "gitBlobSha1": "eeeeeeeeeeeeeeeeeeeeeeeeeeeeeeeeeeeeeeee", "bytes": 7, "sha256": "ffffffffffffffffffffffffffffffffffffffffffffffffffffffffffffffff"}], "sourceBytes": 7, "inputInventorySha256": "bc0b6911031206ee6d07688b411ab5182357093e80f04377f972b3cbf76ca741"}, "decision": {"candidateId": "1111111111111111111111111111111111111111111111111111111111111111", "inputInventorySha256": "bc0b6911031206ee6d07688b411ab5182357093e80f04377f972b3cbf76ca741", "status": "PREPARED_FIXTURE_ONLY", "scopeAllowed": true, "egressAuthorized": false}, "consumerBinding": {"runId": "aaaaaaaaaaaaaaaaaaaaaaaaaaaaaaaa", "candidateId": "cccccccccccccccccccccccccccccccccccccccccccccccccccccccccccccccc", "contentSha256": "dddddddddddddddddddddddddddddddddddddddddddddddddddddddddddddddd", "sourceRevision": "bbbbbbbbbbbbbbbbbbbbbbbbbbbbbbbbbbbbbbbb", "consumerPlanSha256": "7bafa1fb625745bf44bbc2042981c19d89db0e08863b0b203d76151b14f442c7"}, "payloadComplete": false, "scanStatus": "NOT_RUN", "ciAdmission": "BLOCKED", "releaseEligible": false}, "requiredAnalyzerIds": ["semantic_developer_intent", "semantic_quality_policy", "semantic_security_discovery"], "workItems": [{"id": "faedb689e0c63b825162203329d76f2717ebb6afe0844def360fc6c8e2aa5623", "analyzerId": "semantic_developer_intent", "path": "skills/example/SKILL.md", "selectedBlobSha256": "ffffffffffffffffffffffffffffffffffffffffffffffffffffffffffffffff", "promptBase64": "c3ludGhldGljIHByb21wdCBmb3Igc2VtYW50aWNfZGV2ZWxvcGVyX2ludGVudA==", "promptSha256": "6e9470c93b049843cd1c18186de4002a289a9e9149c03ffe8d30cdf197184ad9", "responseBase64": "c3ludGhldGljIHJlc3BvbnNlIGZvciBzZW1hbnRpY19kZXZlbG9wZXJfaW50ZW50", "responseSha256": "8c0799e4dfd327b2e21c4765fb503f9db08a4984d79c3d1d38aab4446f504fdb", "rawGraphBase64": "eyJhcnRpZmFjdFR5cGUiOiAic3ludGhldGljLXJhdy1ncmFwaC12MSIsICJ3b3JrSXRlbUlkIjogImZhZWRiNjg5ZTBjNjNiODI1MTYyMjAzMzI5ZDc2ZjI3MTdlYmI2YWZlMDg0NGRlZjM2MGZjNmM4ZTJhYTU2MjMiLCAiYW5hbHl6ZXJJZCI6ICJzZW1hbnRpY19kZXZlbG9wZXJfaW50ZW50In0=", "rawGraphSha256": "87c7eeb414da76f76a40cd7cc5418d0c16195e0bbf2e7298377af01e0fbc0127", "rawFindingsBase64": "eyJ3b3JrSXRlbUlkIjogImZhZWRiNjg5ZTBjNjNiODI1MTYyMjAzMzI5ZDc2ZjI3MTdlYmI2YWZlMDg0NGRlZjM2MGZjNmM4ZTJhYTU2MjMiLCAiZmluZGluZ3MiOiBbXX0=", "rawFindingsSha256": "e8d05dec598fa5be27c9c62641beb0fa2eeecdde1fad52fb6a8101115daceb8e"}, {"id": "5fc59032bb9e0b19e95ffed230091ddc776c771f6d6cc200a73f017a55360e9d", "analyzerId": "semantic_quality_policy", "path": "skills/example/SKILL.md", "selectedBlobSha256": "ffffffffffffffffffffffffffffffffffffffffffffffffffffffffffffffff", "promptBase64": "c3ludGhldGljIHByb21wdCBmb3Igc2VtYW50aWNfcXVhbGl0eV9wb2xpY3k=", "promptSha256": "647bfbe5224635f5da24e37dccffae9ebff876cfaaf74e84b9f6da2159081d5f", "responseBase64": "c3ludGhldGljIHJlc3BvbnNlIGZvciBzZW1hbnRpY19xdWFsaXR5X3BvbGljeQ==", "responseSha256": "6d8c1cc657ffdf2161ee21c21dde06e42fd9b6829b809e4ec28c8070f91571fa", "rawGraphBase64": "eyJhcnRpZmFjdFR5cGUiOiAic3ludGhldGljLXJhdy1ncmFwaC12MSIsICJ3b3JrSXRlbUlkIjogIjVmYzU5MDMyYmI5ZTBiMTllOTVmZmVkMjMwMDkxZGRjNzc2Yzc3MWY2ZDZjYzIwMGE3M2YwMTdhNTUzNjBlOWQiLCAiYW5hbHl6ZXJJZCI6ICJzZW1hbnRpY19xdWFsaXR5X3BvbGljeSJ9", "rawGraphSha256": "af48e16c30913474fd0eaca24e5acef60aabc5ec44e0b0291adb0c86a647a5f4", "rawFindingsBase64": "eyJ3b3JrSXRlbUlkIjogIjVmYzU5MDMyYmI5ZTBiMTllOTVmZmVkMjMwMDkxZGRjNzc2Yzc3MWY2ZDZjYzIwMGE3M2YwMTdhNTUzNjBlOWQiLCAiZmluZGluZ3MiOiBbXX0=", "rawFindingsSha256": "d993cd812b04798ea09190806d2cb751f8165de55d51fb4e5c6cbadb6fbaa996"}, {"id": "de6c30ed89a5bb1b38b2ae15765d289b282f26128d6bfa5ed1aa465457c60573", "analyzerId": "semantic_security_discovery", "path": "skills/example/SKILL.md", "selectedBlobSha256": "ffffffffffffffffffffffffffffffffffffffffffffffffffffffffffffffff", "promptBase64": "c3ludGhldGljIHByb21wdCBmb3Igc2VtYW50aWNfc2VjdXJpdHlfZGlzY292ZXJ5", "promptSha256": "dc9bf5900c0eee4f2e13ad080b27ffdcada1753965ca6cfbbc6b7e6cd5716178", "responseBase64": "c3ludGhldGljIHJlc3BvbnNlIGZvciBzZW1hbnRpY19zZWN1cml0eV9kaXNjb3Zlcnk=", "responseSha256": "07803f160f4b1ca6e1b70533023e99a27e31e5c9908bd69eb34279cba7149dbc", "rawGraphBase64": "eyJhcnRpZmFjdFR5cGUiOiAic3ludGhldGljLXJhdy1ncmFwaC12MSIsICJ3b3JrSXRlbUlkIjogImRlNmMzMGVkODlhNWJiMWIzOGIyYWUxNTc2NWQyODliMjgyZjI2MTI4ZDZiZmE1ZWQxYWE0NjU0NTdjNjA1NzMiLCAiYW5hbHl6ZXJJZCI6ICJzZW1hbnRpY19zZWN1cml0eV9kaXNjb3ZlcnkifQ==", "rawGraphSha256": "7c37f35c81250cb1a361788af9ee2c0d1bc924b3c32ab7300d7c112e386ea59d", "rawFindingsBase64": "eyJ3b3JrSXRlbUlkIjogImRlNmMzMGVkODlhNWJiMWIzOGIyYWUxNTc2NWQyODliMjgyZjI2MTI4ZDZiZmE1ZWQxYWE0NjU0NTdjNjA1NzMiLCAiZmluZGluZ3MiOiBbXX0=", "rawFindingsSha256": "8190724de14da05d32b8c14dcbad3c3d99f1149bc0e7626690012917ab233b12"}]}